{
  "artifactSchema": "urn:uuid:876284f1-c7c1-468f-bab6-c679e564c3fe",
  "protocolRelease": "ghostbridge/e1.r0-draft.1",
  "registryClass": "gb.registry.facet-property",
  "facetPropertyArtifact": "urn:uuid:aef799c0-6fd3-4e3d-a0bd-c804e137661f",
  "facets": [
    {
      "id": "gb.facet.host.core",
      "revision": 1,
      "code": "HC"
    },
    {
      "id": "gb.facet.agent.core",
      "revision": 1,
      "code": "AC"
    },
    {
      "id": "gb.facet.trust-verification.core",
      "revision": 1,
      "code": "TC"
    },
    {
      "id": "gb.facet.host.governed-execution",
      "revision": 1,
      "code": "HG"
    },
    {
      "id": "gb.facet.agent.governed-execution",
      "revision": 1,
      "code": "AG"
    }
  ],
  "failureCodes": [
    {
      "code": "FI",
      "meaning": "a missing, false, unknown, or contradicted invariant makes the applicable facet false and candidate incompatible, without fallback"
    },
    {
      "code": "FA",
      "meaning": "deny the operation before authority, state, or effect creation; quarantine or recover ambiguous partial state fail-closed"
    },
    {
      "code": "FH",
      "meaning": "preserve immutable committed history and reject rollback, mutation, or mutable reinterpretation"
    },
    {
      "code": "FP",
      "meaning": "emit only the applicable disclosure-safe H-12 outcome"
    },
    {
      "code": "FN",
      "meaning": "narrowing may affect only the exact capability/version and may never widen or waive a shared invariant"
    }
  ],
  "invariantProperties": [
    {
      "token": "release-identity-and-status",
      "revision": 1,
      "classification": "invariant",
      "facets": [
        "HC",
        "AC",
        "TC"
      ],
      "meaning": "Exact canonical release identity is the sole protocol compatibility identity; status and history cannot be inferred or rewritten",
      "roles": "Each participant role",
      "failure": [
        "FI",
        "FH"
      ]
    },
    {
      "token": "participant-release-support",
      "revision": 1,
      "classification": "invariant",
      "facets": [
        "HC",
        "AC",
        "TC"
      ],
      "meaning": "Each participant owns its supported-release metadata; bilateral candidates are exact intersection plus H-03 evidence",
      "roles": "Participant supplying or verifying release metadata",
      "failure": [
        "FI"
      ]
    },
    {
      "token": "deterministic-release-negotiation",
      "revision": 1,
      "classification": "invariant",
      "facets": [
        "HC",
        "AC"
      ],
      "meaning": "Client and Agent apply REQ-VERS-0014 with no second channel or fallback",
      "roles": "Client/Host and Agent only; Trust Core is excluded",
      "failure": [
        "FI"
      ]
    },
    {
      "token": "immutable-negotiated-result",
      "revision": 1,
      "classification": "invariant",
      "facets": [
        "HC",
        "AC"
      ],
      "meaning": "The complete REQ-VERS-0016 result is committed atomically and remains immutable",
      "roles": "Host and Agent",
      "failure": [
        "FI",
        "FH"
      ]
    },
    {
      "token": "facet-claim-boundary",
      "revision": 1,
      "classification": "invariant",
      "facets": [
        "HC",
        "AC",
        "TC",
        "HG",
        "AG"
      ],
      "meaning": "A facet proves only its registered invariants; it grants no arbitrary capability or action authority",
      "roles": "Claimant and verifier",
      "failure": [
        "FI"
      ]
    },
    {
      "token": "source-claim-intersection",
      "revision": 1,
      "classification": "invariant",
      "facets": [
        "HC",
        "AC"
      ],
      "meaning": "Atomic registered claims narrow monotonically; derived results are not claims",
      "roles": "Host and Agent negotiation",
      "failure": [
        "FI",
        "FN"
      ]
    },
    {
      "token": "discovery-observation",
      "revision": 1,
      "classification": "invariant",
      "facets": [
        "HC",
        "AC"
      ],
      "meaning": "Discovery is current candidate observation, never authority by itself",
      "roles": "Discovery producer/consumer",
      "failure": [
        "FI",
        "FA"
      ]
    },
    {
      "token": "lifecycle-ordering",
      "revision": 1,
      "classification": "invariant",
      "facets": [
        "HC",
        "AC",
        "TC"
      ],
      "meaning": "Operations and authority are admitted only in their accepted lifecycle order",
      "roles": "Applicable participant",
      "failure": [
        "FA"
      ]
    },
    {
      "token": "installation-redemption",
      "revision": 1,
      "classification": "invariant",
      "facets": [
        "HC",
        "AC"
      ],
      "meaning": "Grant, consent, intent, replay, and Connection creation retain separate authority boundaries",
      "roles": "Host and Agent",
      "failure": [
        "FA",
        "FH"
      ]
    },
    {
      "token": "connection-authority-lifecycle",
      "revision": 1,
      "classification": "invariant",
      "facets": [
        "HC",
        "AC"
      ],
      "meaning": "Connection authority, scope, states, replacement, recovery, and terminality are exact",
      "roles": "Host owner and Agent enforcer",
      "failure": [
        "FA",
        "FH"
      ]
    },
    {
      "token": "authorization-floor",
      "revision": 1,
      "classification": "invariant",
      "facets": [
        "HC",
        "AC",
        "HG",
        "AG"
      ],
      "meaning": "Authentication, policy, consent, Connection, capability, Approval, and other gates remain separate; Agent is final enforcement point",
      "roles": "Host defense-in-depth; Agent final enforcement",
      "failure": [
        "FA"
      ]
    },
    {
      "token": "compatibility-identity",
      "revision": 1,
      "classification": "invariant",
      "facets": [
        "HC",
        "AC",
        "TC"
      ],
      "meaning": "Compatibility uses exact immutable directed evidence and never becomes alternate negotiation",
      "roles": "Every release participant",
      "failure": [
        "FI",
        "FH"
      ]
    },
    {
      "token": "compatibility-evolution",
      "revision": 1,
      "classification": "invariant",
      "facets": [
        "HC",
        "AC",
        "TC"
      ],
      "meaning": "Unknown Core, schema change, errata, support state, stored-object pinning, and legacy history follow D1",
      "roles": "Every release participant",
      "failure": [
        "FI",
        "FH"
      ]
    },
    {
      "token": "extension-openness",
      "revision": 1,
      "classification": "invariant",
      "facets": [
        "HC",
        "AC",
        "TC",
        "HG",
        "AG"
      ],
      "meaning": "Core is closed except at registered locations; unknown/forwarded extension behavior is class-specific",
      "roles": "Every applicable object processor",
      "failure": [
        "FI",
        "FP"
      ]
    },
    {
      "token": "extension-selection",
      "revision": 1,
      "classification": "invariant",
      "facets": [
        "HC",
        "AC",
        "TC",
        "HG",
        "AG"
      ],
      "meaning": "Required, optional, selected, and occurring sets and finite dependencies are exact; experiments remain separate",
      "roles": "Every selecting/processing role",
      "failure": [
        "FI",
        "FN"
      ]
    },
    {
      "token": "transport-origin-routing",
      "revision": 1,
      "classification": "invariant",
      "facets": [
        "HC",
        "AC",
        "TC"
      ],
      "meaning": "Exact Origin, request target, release route, DNS/SSRF, and redirect rules apply",
      "roles": "Networked participant",
      "failure": [
        "FA",
        "FP"
      ]
    },
    {
      "token": "transport-http-envelope",
      "revision": 1,
      "classification": "invariant",
      "facets": [
        "HC",
        "AC",
        "TC"
      ],
      "meaning": "Accepted methods/resources, media, UTF-8, finite JSON, headers, TLS, and framing are exact",
      "roles": "Networked participant",
      "failure": [
        "FA",
        "FP"
      ]
    },
    {
      "token": "transport-retry-time-budget",
      "revision": 1,
      "classification": "invariant",
      "facets": [
        "HC",
        "AC",
        "TC"
      ],
      "meaning": "Abort, ambiguity, retry class, Retry-After, and monotonic budgets remain distinct from protocol outcomes",
      "roles": "Networked participant",
      "failure": [
        "FA",
        "FP"
      ]
    },
    {
      "token": "transport-parser-resource-limits",
      "revision": 1,
      "classification": "invariant",
      "facets": [
        "HC",
        "AC",
        "TC"
      ],
      "meaning": "Accepted size, depth, parser, framing, and emission limits fail closed",
      "roles": "Networked participant",
      "failure": [
        "FA",
        "FP"
      ]
    },
    {
      "token": "transport-intermediary-boundary",
      "revision": 1,
      "classification": "invariant",
      "facets": [
        "HC",
        "AC",
        "TC"
      ],
      "meaning": "Caches, proxies, browsers, redirects, intermediaries, and credentials cannot alter authority",
      "roles": "Networked participant",
      "failure": [
        "FA",
        "FP"
      ]
    },
    {
      "token": "error-outcome-separation",
      "revision": 1,
      "classification": "invariant",
      "facets": [
        "HC",
        "AC",
        "TC",
        "HG",
        "AG"
      ],
      "meaning": "Transport, protocol, authority, and resource outcomes and stable error classes remain distinct",
      "roles": "Producer and consumer",
      "failure": [
        "FP"
      ]
    },
    {
      "token": "error-precedence-and-privacy",
      "revision": 1,
      "classification": "invariant",
      "facets": [
        "HC",